<xs:schema attributeFormDefault="unqualified" elementFormDefault="qualified" xmlns:xs="http://www.w3.org/2001/XMLSchema">
	<xs:element name="list">
		<xs:complexType>
			<xs:sequence>
				<xs:element name="seed" maxOccurs="unbounded" minOccurs="0">
					<xs:complexType>
						<xs:simpleContent>
							<xs:extension base="xs:string">
								<xs:attribute type="xs:short" name="id" use="required"/>
								<xs:attribute type="xs:byte" name="level" use="required"/>
								<xs:attribute type="xs:short" name="cropId" use="required"/>
								<xs:attribute type="xs:short" name="matureId" use="required"/>
								<xs:attribute type="xs:short" name="reward1" use="required"/>
								<xs:attribute type="xs:short" name="reward2" use="required"/>
								<xs:attribute type="xs:byte" name="castleId" use="required"/>
								<xs:attribute type="xs:boolean" name="isAlternative" use="required"/>
								<xs:attribute type="xs:short" name="seedLimit" use="required"/>
								<xs:attribute type="xs:short" name="cropLimit" use="required"/>
							</xs:extension>
						</xs:simpleContent>
					</xs:complexType>
				</xs:element>
			</xs:sequence>
		</xs:complexType>
	</xs:element>
</xs:schema>